{
  "$schema": "https://json-schema.org/draft/2020-12/schema",
  "title": "SMTP provider request envelope",
  "type": "object",
  "required": ["request_id", "provider", "operation", "direction", "channel", "occurred_at", "payload"],
  "properties": {
    "request_id": { "type": "string", "minLength": 1 },
    "provider": { "const": "smtp" },
    "operation": { "enum": ["email.send"] },
    "direction": { "const": "outbound" },
    "channel": { "const": "email" },
    "account_public_id": { "type": "string", "minLength": 1 },
    "occurred_at": { "type": "string", "format": "date-time" },
    "payload": { "type": "object" },
    "legacy_contract": { "type": "object" }
  },
  "additionalProperties": false
}
